<?xml version="1.0" encoding="UTF-8"?>
<!DOCTYPE pr SYSTEM "pr_final.dtd">
<pr>
    <meta>
        <keyName>PRI2019-A80424-T7</keyName>
        <title>Servidor com informação acerca de obras musicais e dos respetivos compositores </title>
        <bDate>11 de novembro de 2019</bDate>
        <eDate>18 de novembro de 2019</eDate>
        <supervisor>
            <name>José Carlos Ramalho</name>
            <email>jcr@di.uminho.pt</email>
            <homepage>http://www4.di.uminho.pt/~jcr/</homepage>
        </supervisor>
    </meta>
    <workTeam>
        <member>
            <identifier>A80424</identifier>
            <name>José Pedro Saraiva de Carvalho</name>
            <email>a80424@alunos.uminho.pt</email>
            <photo path="photo.jpg"/>
        </member>
    </workTeam>
    <abstract>
        
        <p>Este trabalho semanal consistia em desenvolver um servidor que disponibiliza as informações acerca de um conjunto de obras e respetivos compositores armazenados numa base de dados não relacional em <i>MongoDB</i>, com o auxílio de <i>NodeJS</i> e de <i>ExpressJS</i>.</p>
        <p>O servidor é capaz de receber pedidos de <b>GET</b> para o conjunto total de obras, para a informação individual de cada obra, para a informação acerca do período, ano de criação e compositor da obra, para o conjunto total de compositores e para as obras de cada compositor.</p>
        
    </abstract>
    <deliverables>
        <deliverable path="../obras">Diretoria que contém o TPC7</deliverable>
        <deliverable path="pr.xml">Ficheiro XML que contém a informação deste PR</deliverable>
        <deliverable path="pr.xsl">Stylesheet que contém a informação deste PR</deliverable>
        <deliverable path="../obras.json">Ficheiro em JSON que contem a informação que depois é apropriada pela base de dados em mongo.</deliverable>
    </deliverables>
</pr>

