<?xml version="1.0" encoding="UTF-8"?>
<!DOCTYPE pr SYSTEM "pr_final.dtd">
<pr>
    <meta>
        <keyName>PRI2019-A80424-T6</keyName>
        <title>Servidor utilizando NodeJS e ExpressJS com dados obtidos de uma BD em MongoDB </title>
        <bDate>4 de novembro de 2019</bDate>
        <eDate>11 de novembro de 2019</eDate>
        <supervisor>
            <name>José Carlos Ramalho</name>
            <email>jcr@di.uminho.pt</email>
            <homepage>http://www4.di.uminho.pt/~jcr/</homepage>
        </supervisor>
    </meta>
    <workTeam>
        <member>
            <identifier>A80424</identifier>
            <name>José Pedro Saraiva de Carvalho</name>
            <email>a80424@alunos.uminho.pt</email>
            <photo path="photo.jpg"/>
        </member>
    </workTeam>
    <abstract>
        
        <p>Este trabalho semanal consistia em desenvolver um servidor que disponibiliza as informações acerca de um conjunto de filmes armazenados numa base de dados não relacional em <i>MongoDB</i>, com o auxílio de <i>NodeJS</i> e de <i>ExpressJS</i>.</p>
        <p>O servidor é capaz de receber pedidos de <b>GET</b> para o conjunto total de filmes e para a informação individual de cada filme. O servidor também é capaz de receber pedidos de <b>POST</b> para acrescentar filmes. Por fim o servidor é capaz de receber pedidos de <b>DELETE</b> para apagar filmes.</p>
        
    </abstract>
    <deliverables>
        <deliverable path="../gfilmes">Diretoria que contém a o TPC5</deliverable>
        <deliverable path="pr.xml">Ficheiro XML que contém a informação deste PR</deliverable>
        <deliverable path="pr.xsl">Stylesheet que contém a informação deste PR</deliverable>
    </deliverables>
</pr>
